[
    {
      "Name": "John Doe",
      "Email": "john.doe@example.com",
      "LoanAmount": 5000,
      "LoanTerm": 24,
      "YearlyIncome": 55000,
      "Age": 30,
      "ExpectedLoanId": 1001,
      "ExpectedLoanRate": 5
    },
    {
      "Name": "Jane Smith",
      "Email": "jane.smith@example.com",
      "LoanAmount": 10000,
      "LoanTerm": 36,
      "YearlyIncome": 65000,
      "Age": 28,
      "ExpectedLoanId": 1002,
      "ExpectedLoanRate": 4.5
    },
    {
      "Name": "Alice Brown",
      "Email": "alice.brown@example.com",
      "LoanAmount": 15000,
      "LoanTerm": 48,
      "YearlyIncome": 75000,
      "Age": 35,
      "ExpectedLoanId": 1003,
      "ExpectedLoanRate": 4
    },
    {
      "Name": "Bob White",
      "Email": "bob.white@example.com",
      "LoanAmount": 20000,
      "LoanTerm": 60,
      "YearlyIncome": 85000,
      "Age": 40,
      "ExpectedLoanId": 1004,
      "ExpectedLoanRate": 3.5
    },
    {
      "Name": "Chris Green",
      "Email": "chris.green@example.com",
      "LoanAmount": 25000,
      "LoanTerm": 72,
      "YearlyIncome": 95000,
      "Age": 45,
      "ExpectedLoanId": 1005,
      "ExpectedLoanRate": 3
    }
  ]
  